{
  "protocol_version": "0.1.0",
  "id": "field.sample_at_cells",
  "version": "1.0.0",
  "scope": "population",
  "phase": 4,
  "scientific_role": "numerical",
  "maturity": "exploratory",
  "description": "Sample a species field at each cell position.",
  "inputs": {
    "concentration": {"shape": "field.scalar", "quantity": "concentration", "unit": "uM", "species_parameter": "species"}
  },
  "outputs": {
    "local_concentration": {"shape": "cell.scalar", "quantity": "concentration", "unit": "uM", "species_parameter": "species"}
  },
  "parameters": {
    "species": {"type": "string"}
  },
  "state": {},
  "initial_outputs": []
}
