{
  "protocol_version": "0.1.0",
  "id": "growth.linear_elongation",
  "version": "1.0.0",
  "scope": "population",
  "phase": 2,
  "scientific_role": "numerical",
  "maturity": "exploratory",
  "description": "Illustrative constant axial elongation of known capsules; diameter stays fixed and no division occurs.",
  "inputs": {},
  "outputs": {
    "length": {"shape": "cell.scalar", "quantity": "capsule_length", "unit": "um"},
    "diameter": {"shape": "cell.scalar", "quantity": "capsule_diameter", "unit": "um"}
  },
  "parameters": {
    "elongation_rate": {"type": "number", "unit": "um/s", "minimum": 0}
  },
  "state": {},
  "initial_outputs": ["length", "diameter"]
}
