{
  "protocol_version": "0.1.0",
  "id": "field.hold",
  "version": "1.0.0",
  "scope": "environment",
  "phase": 3,
  "scientific_role": "closure",
  "maturity": "exploratory",
  "description": "Hold a uniform species concentration for a contract example.",
  "inputs": {},
  "outputs": {
    "concentration": {"shape": "field.scalar", "quantity": "concentration", "unit": "uM", "species_parameter": "species"}
  },
  "parameters": {
    "species": {"type": "string"},
    "level": {"type": "number", "unit": "uM", "minimum": 0}
  },
  "state": {
    "concentration": {"shape": "field.scalar", "unit": "uM", "on_division": "not_applicable"}
  },
  "initial_outputs": ["concentration"]
}
