{
  "protocol_version": "0.1.0",
  "id": "field.deposit_box_support",
  "version": "2.0.0",
  "scope": "population",
  "phase": 6,
  "scientific_role": "numerical",
  "maturity": "exploratory",
  "description": "Distribute per-cell uptake from declared positions over fixed physical supports with normalized overlap weights.",
  "inputs": {
    "uptake_flux": {"shape": "cell.scalar", "quantity": "uptake_flux", "unit": "molecule/s", "species_parameter": "species"},
    "position": {"shape": "cell.vector", "quantity": "position", "unit": "um"}
  },
  "outputs": {
    "consumption_rate": {"shape": "field.scalar", "quantity": "consumption_rate", "unit": "uM/s", "species_parameter": "species"}
  },
  "parameters": {
    "species": {"type": "string"},
    "support_x_um": {"type": "number", "unit": "um", "minimum": 0},
    "support_y_um": {"type": "number", "unit": "um", "minimum": 0},
    "support_z_um": {"type": "number", "unit": "um", "minimum": 0}
  },
  "state": {},
  "initial_outputs": ["consumption_rate"]
}
